{"boards":[{"immutable_reference":"ghcr.io/techno-optimist/p42-prizes-verifiers/q6-intersecting-hypergraph@sha256:45a5facdd3e3f3602d16aebf4307dcc95e49dc312cdd61362407ec9f2e89f786","index":{"digest":"sha256:45a5facdd3e3f3602d16aebf4307dcc95e49dc312cdd61362407ec9f2e89f786","digest_reference_bytes":"downloaded_and_hashed","publication_tag_bytes":"downloaded_and_hashed","size":647,"tag_resolves_to_same_index":true},"platforms":[{"child_manifest":{"bytes":"downloaded_and_hashed","digest":"sha256:01c0929bc907b9be3ff7c73da1c4cdbc3150a81d72fe9c43f2eecad98f6e72d6","size":2570},"config":{"bytes":"downloaded_and_hashed","digest":"sha256:fb4fb92c810fddb9f52c837910900038f4b96189f9bd71681c5469fbae2cf08e","size":9679},"layers":[{"availability":"not_claimed","bytes":"not_downloaded_or_hashed","digest":"sha256:0c8d55a45c0dc58de60579b9cc5b708de9e7957f4591fc7de941b67c7e245da0","mediaType":"application/vnd.oci.image.layer.v1.tar+gzip","size":29778596},{"availability":"not_claimed","bytes":"not_downloaded_or_hashed","digest":"sha256:e390f4c2bfbaf8c9ff09ccd09b3ee96552b64c56a147752129e838b506564b43","mediaType":"application/vnd.oci.image.layer.v1.tar+gzip","size":1292733},{"availability":"not_claimed","bytes":"not_downloaded_or_hashed","digest":"sha256:03a8c32cd3b847db1be29363909de651391766ce2a248ef2a06d3520cc547191","mediaType":"application/vnd.oci.image.layer.v1.tar+gzip","size":12233512},{"availability":"not_claimed","bytes":"not_downloaded_or_hashed","digest":"sha256:d4eb155fb2bb1e64064040956fa750883adc8eaf4427a5925b301879945ca9aa","mediaType":"application/vnd.oci.image.layer.v1.tar+gzip","size":251},{"availability":"not_claimed","bytes":"not_downloaded_or_hashed","digest":"sha256:93f6bfebd7dbbc50125b2b78ccd79c174e26963c5421caf0bfd0ed50e72af224","mediaType":"application/vnd.oci.image.layer.v1.tar+gzip","size":7638},{"availability":"not_claimed","bytes":"not_downloaded_or_hashed","digest":"sha256:ec4cbed3c5389fcfb80eb31938208ec0cc9bd2042b9a428347182749e4184b54","mediaType":"application/vnd.oci.image.layer.v1.tar+gzip","size":1690},{"availability":"not_claimed","bytes":"not_downloaded_or_hashed","digest":"sha256:df3e3181157c736dde5ea36851770545c1b58f2bff0290a29a84cfd6fddbcbb6","mediaType":"application/vnd.oci.image.layer.v1.tar+gzip","size":5352173},{"availability":"not_claimed","bytes":"not_downloaded_or_hashed","digest":"sha256:eb4fa88de37897f5e196faba03e259b16217af26b5de6f06d1e08fbf46b23b58","mediaType":"application/vnd.oci.image.layer.v1.tar+gzip","size":194054},{"availability":"not_claimed","bytes":"not_downloaded_or_hashed","digest":"sha256:b0019d787288dc9cd255836969c20ae93cc8b5a3c9a9e873306b1d0581ba93f9","mediaType":"application/vnd.oci.image.layer.v1.tar+gzip","size":48453},{"availability":"not_claimed","bytes":"not_downloaded_or_hashed","digest":"sha256:45220543b4ece7cc933c0ffe393e8f296872be03b94b3b385c1da8c6d33b98c0","mediaType":"application/vnd.oci.image.layer.v1.tar+gzip","size":13665},{"availability":"not_claimed","bytes":"not_downloaded_or_hashed","digest":"sha256:4f4fb700ef54461cfa02571ae0db9a0dc1e0cdb5577484a6d75e68dc38e8acc1","mediaType":"application/vnd.oci.image.layer.v1.tar+gzip","size":32},{"availability":"not_claimed","bytes":"not_downloaded_or_hashed","digest":"sha256:4f4fb700ef54461cfa02571ae0db9a0dc1e0cdb5577484a6d75e68dc38e8acc1","mediaType":"application/vnd.oci.image.layer.v1.tar+gzip","size":32}],"platform":"linux/amd64"},{"child_manifest":{"bytes":"downloaded_and_hashed","digest":"sha256:eb8d98a3f21a37b37660b1474f9bf74a03ae1de23729aede992c73769f9a1321","size":2570},"config":{"bytes":"downloaded_and_hashed","digest":"sha256:091ff3eba552a81c14e6b449317ea6b587a5c0bb29155acbd07a68db3b47b5f4","size":9680},"layers":[{"availability":"not_claimed","bytes":"not_downloaded_or_hashed","digest":"sha256:3ea009573b472d108af9af31ec35a06fe3649084f6611cf11f7d594b85cf7a7c","mediaType":"application/vnd.oci.image.layer.v1.tar+gzip","size":30140064},{"availability":"not_claimed","bytes":"not_downloaded_or_hashed","digest":"sha256:0cb211e8ccd77900be58fd6e7a362d55e8fdffcd879b436430d9705ae9589fef","mediaType":"application/vnd.oci.image.layer.v1.tar+gzip","size":1273438},{"availability":"not_claimed","bytes":"not_downloaded_or_hashed","digest":"sha256:2ccddbdefe8fc92210e98c3afacf4892b93af3a3e83d5842cfcd66af49984be4","mediaType":"application/vnd.oci.image.layer.v1.tar+gzip","size":12145480},{"availability":"not_claimed","bytes":"not_downloaded_or_hashed","digest":"sha256:594a9d4347477cbd948ef195f4ac9bdd8a866a709d32385ae7832689d0b0b235","mediaType":"application/vnd.oci.image.layer.v1.tar+gzip","size":251},{"availability":"not_claimed","bytes":"not_downloaded_or_hashed","digest":"sha256:d07dc663b9d88be28c7dc37ac5c6e3fe8900909d4584609a357553b4eb729e2b","mediaType":"application/vnd.oci.image.layer.v1.tar+gzip","size":7638},{"availability":"not_claimed","bytes":"not_downloaded_or_hashed","digest":"sha256:be3d786c07436ca6508224db7da5a923dfaa6ccd48bc1b0dba27e2c405df93fa","mediaType":"application/vnd.oci.image.layer.v1.tar+gzip","size":1691},{"availability":"not_claimed","bytes":"not_downloaded_or_hashed","digest":"sha256:02267f1c6b33f29023386a25db74f3af55f8110ebcb59ce9a1bd043f83377183","mediaType":"application/vnd.oci.image.layer.v1.tar+gzip","size":5329427},{"availability":"not_claimed","bytes":"not_downloaded_or_hashed","digest":"sha256:31e86d457faa029e6aa4fccfeea9b3a5b6393689ec2eb8fd60b81813b61ff44a","mediaType":"application/vnd.oci.image.layer.v1.tar+gzip","size":194054},{"availability":"not_claimed","bytes":"not_downloaded_or_hashed","digest":"sha256:5a5cf855579cbc9a935ff3ab528f7d499d42d0cddcd6a2259f56ddc636b7890a","mediaType":"application/vnd.oci.image.layer.v1.tar+gzip","size":48451},{"availability":"not_claimed","bytes":"not_downloaded_or_hashed","digest":"sha256:d0b7f42418f6f51c4b991e1a4e43c160949c56924d2cdeedbbcb54e450b4c0c5","mediaType":"application/vnd.oci.image.layer.v1.tar+gzip","size":13664},{"availability":"not_claimed","bytes":"not_downloaded_or_hashed","digest":"sha256:4f4fb700ef54461cfa02571ae0db9a0dc1e0cdb5577484a6d75e68dc38e8acc1","mediaType":"application/vnd.oci.image.layer.v1.tar+gzip","size":32},{"availability":"not_claimed","bytes":"not_downloaded_or_hashed","digest":"sha256:4f4fb700ef54461cfa02571ae0db9a0dc1e0cdb5577484a6d75e68dc38e8acc1","mediaType":"application/vnd.oci.image.layer.v1.tar+gzip","size":32}],"platform":"linux/arm64"}],"publication_tag":"ghcr.io/techno-optimist/p42-prizes-verifiers/q6-intersecting-hypergraph:1b65b84b13dbe350339bcd985b44b5224e6c6df7","repository":"ghcr.io/techno-optimist/p42-prizes-verifiers/q6-intersecting-hypergraph","slug":"q6-intersecting-hypergraph"},{"immutable_reference":"ghcr.io/techno-optimist/p42-prizes-verifiers/erdos-min-overlap@sha256:8932328091b948d0a2d983dc21c230ab5d50441a105b25bd29df3b2898f8f82f","index":{"digest":"sha256:8932328091b948d0a2d983dc21c230ab5d50441a105b25bd29df3b2898f8f82f","digest_reference_bytes":"downloaded_and_hashed","publication_tag_bytes":"downloaded_and_hashed","size":647,"tag_resolves_to_same_index":true},"platforms":[{"child_manifest":{"bytes":"downloaded_and_hashed","digest":"sha256:246e3b648dc7f2889abfd0313bb64847ab9f923f82f6c84dbd12f44a72aaefa3","size":2570},"config":{"bytes":"downloaded_and_hashed","digest":"sha256:7f37f7c8ea82727fff6626770465ac940ca8bbe201f6a2c4182afb887dad16e6","size":9572},"layers":[{"availability":"not_claimed","bytes":"not_downloaded_or_hashed","digest":"sha256:0c8d55a45c0dc58de60579b9cc5b708de9e7957f4591fc7de941b67c7e245da0","mediaType":"application/vnd.oci.image.layer.v1.tar+gzip","size":29778596},{"availability":"not_claimed","bytes":"not_downloaded_or_hashed","digest":"sha256:e390f4c2bfbaf8c9ff09ccd09b3ee96552b64c56a147752129e838b506564b43","mediaType":"application/vnd.oci.image.layer.v1.tar+gzip","size":1292733},{"availability":"not_claimed","bytes":"not_downloaded_or_hashed","digest":"sha256:03a8c32cd3b847db1be29363909de651391766ce2a248ef2a06d3520cc547191","mediaType":"application/vnd.oci.image.layer.v1.tar+gzip","size":12233512},{"availability":"not_claimed","bytes":"not_downloaded_or_hashed","digest":"sha256:d4eb155fb2bb1e64064040956fa750883adc8eaf4427a5925b301879945ca9aa","mediaType":"application/vnd.oci.image.layer.v1.tar+gzip","size":251},{"availability":"not_claimed","bytes":"not_downloaded_or_hashed","digest":"sha256:93f6bfebd7dbbc50125b2b78ccd79c174e26963c5421caf0bfd0ed50e72af224","mediaType":"application/vnd.oci.image.layer.v1.tar+gzip","size":7638},{"availability":"not_claimed","bytes":"not_downloaded_or_hashed","digest":"sha256:ec4cbed3c5389fcfb80eb31938208ec0cc9bd2042b9a428347182749e4184b54","mediaType":"application/vnd.oci.image.layer.v1.tar+gzip","size":1690},{"availability":"not_claimed","bytes":"not_downloaded_or_hashed","digest":"sha256:5dc3a9bd613e2bbc9c59e5e6b6e72cb9a6759d4aa88cb08129ced2212b150e17","mediaType":"application/vnd.oci.image.layer.v1.tar+gzip","size":5352110},{"availability":"not_claimed","bytes":"not_downloaded_or_hashed","digest":"sha256:b50d961d45894d23186b373e3f664bf1d2b4011c031b350c677f7d107d5ea38a","mediaType":"application/vnd.oci.image.layer.v1.tar+gzip","size":194051},{"availability":"not_claimed","bytes":"not_downloaded_or_hashed","digest":"sha256:f339a973d02484dd9cc06b5ecb48a01ddb316cadced62d1017693c1f98c7bbd1","mediaType":"application/vnd.oci.image.layer.v1.tar+gzip","size":48451},{"availability":"not_claimed","bytes":"not_downloaded_or_hashed","digest":"sha256:833f962c0fb5041de8fd6ec66facb1927cf01c8b18d3ef759287e7f496393238","mediaType":"application/vnd.oci.image.layer.v1.tar+gzip","size":26463},{"availability":"not_claimed","bytes":"not_downloaded_or_hashed","digest":"sha256:4f4fb700ef54461cfa02571ae0db9a0dc1e0cdb5577484a6d75e68dc38e8acc1","mediaType":"application/vnd.oci.image.layer.v1.tar+gzip","size":32},{"availability":"not_claimed","bytes":"not_downloaded_or_hashed","digest":"sha256:4f4fb700ef54461cfa02571ae0db9a0dc1e0cdb5577484a6d75e68dc38e8acc1","mediaType":"application/vnd.oci.image.layer.v1.tar+gzip","size":32}],"platform":"linux/amd64"},{"child_manifest"